{
	"$id": "https://craftabot.dev/schemas/experiment-result.schema.json",
	"title": "Craft A Bot experiment result (v1)",
	"description": "What an experiment measured: for each metric and factor, every treatment level against the baseline as a difference with its interval, n, test and cost; the verdict over the intervals; the note; a digest (72-EXPERIMENTS.md §3).",
	"$schema": "https://json-schema.org/draft/2020-12/schema",
	"type": "object",
	"properties": {
		"schemaVersion": {
			"type": "number",
			"const": 1
		},
		"id": {
			"type": "string",
			"minLength": 1
		},
		"experimentId": {
			"type": "string",
			"minLength": 1
		},
		"title": {
			"type": "string",
			"minLength": 1
		},
		"hypothesis": {
			"type": "string"
		},
		"controls": {
			"type": "array",
			"items": {
				"type": "string"
			}
		},
		"obligations": {
			"type": "array",
			"items": {
				"type": "string"
			}
		},
		"ranAt": {
			"type": "string",
			"format": "date-time",
			"pattern": "^(?:(?:\\d\\d[2468][048]|\\d\\d[13579][26]|\\d\\d0[48]|[02468][048]00|[13579][26]00)-02-29|\\d{4}-(?:(?:0[13578]|1[02])-(?:0[1-9]|[12]\\d|3[01])|(?:0[469]|11)-(?:0[1-9]|[12]\\d|30)|(?:02)-(?:0[1-9]|1\\d|2[0-8])))T(?:(?:[01]\\d|2[0-3]):[0-5]\\d(?::[0-5]\\d(?:\\.\\d+)?)?(?:Z))$"
		},
		"populationDigest": {
			"type": "string"
		},
		"workflowIds": {
			"type": "array",
			"items": {
				"type": "string"
			}
		},
		"campaignIds": {
			"type": "array",
			"items": {
				"type": "string"
			}
		},
		"effects": {
			"type": "array",
			"items": {
				"type": "object",
				"properties": {
					"experimentId": {
						"type": "string",
						"minLength": 1
					},
					"metricId": {
						"type": "string",
						"minLength": 1
					},
					"controlIds": {
						"type": "array",
						"items": {
							"type": "string"
						}
					},
					"factor": {
						"type": "object",
						"properties": {
							"axis": {
								"type": "string",
								"enum": [
									"guard",
									"context",
									"executors",
									"knob",
									"brain"
								]
							},
							"baseline": {
								"type": "string"
							},
							"treatment": {
								"type": "string"
							}
						},
						"required": [
							"axis",
							"baseline",
							"treatment"
						]
					},
					"baseline": {
						"type": "object",
						"properties": {
							"value": {
								"type": "number"
							},
							"n": {
								"type": "integer",
								"minimum": 0,
								"maximum": 9007199254740991
							},
							"interval": {
								"type": "array",
								"prefixItems": [
									{
										"type": "number"
									},
									{
										"type": "number"
									}
								]
							}
						},
						"required": [
							"value",
							"n",
							"interval"
						]
					},
					"treatment": {
						"type": "object",
						"properties": {
							"value": {
								"type": "number"
							},
							"n": {
								"type": "integer",
								"minimum": 0,
								"maximum": 9007199254740991
							},
							"interval": {
								"type": "array",
								"prefixItems": [
									{
										"type": "number"
									},
									{
										"type": "number"
									}
								]
							}
						},
						"required": [
							"value",
							"n",
							"interval"
						]
					},
					"delta": {
						"type": "number"
					},
					"tier": {
						"type": "string"
					},
					"untestable": {
						"type": "boolean",
						"const": true
					},
					"interval": {
						"type": "array",
						"prefixItems": [
							{
								"type": "number"
							},
							{
								"type": "number"
							}
						]
					},
					"p": {
						"type": "number",
						"minimum": 0,
						"maximum": 1
					},
					"method": {
						"type": "string",
						"minLength": 1
					},
					"underpowered": {
						"type": "boolean"
					},
					"slices": {
						"type": "array",
						"items": {
							"type": "object",
							"properties": {
								"where": {
									"type": "object",
									"propertyNames": {
										"type": "string"
									},
									"additionalProperties": {
										"type": "string"
									}
								},
								"delta": {
									"type": "number"
								},
								"interval": {
									"type": "array",
									"prefixItems": [
										{
											"type": "number"
										},
										{
											"type": "number"
										}
									]
								},
								"n": {
									"type": "object",
									"properties": {
										"baseline": {
											"type": "integer",
											"minimum": 0,
											"maximum": 9007199254740991
										},
										"treatment": {
											"type": "integer",
											"minimum": 0,
											"maximum": 9007199254740991
										}
									},
									"required": [
										"baseline",
										"treatment"
									]
								}
							},
							"required": [
								"where",
								"delta",
								"interval",
								"n"
							]
						}
					},
					"cost": {
						"type": "object",
						"properties": {
							"tokensPerCase": {
								"type": "object",
								"properties": {
									"baseline": {
										"type": "number"
									},
									"treatment": {
										"type": "number"
									}
								},
								"required": [
									"baseline",
									"treatment"
								]
							},
							"approvalsPerCase": {
								"type": "object",
								"properties": {
									"baseline": {
										"type": "number"
									},
									"treatment": {
										"type": "number"
									}
								},
								"required": [
									"baseline",
									"treatment"
								]
							},
							"escalationRate": {
								"type": "object",
								"properties": {
									"baseline": {
										"type": "number"
									},
									"treatment": {
										"type": "number"
									}
								},
								"required": [
									"baseline",
									"treatment"
								]
							},
							"wallMsPerCase": {
								"type": "object",
								"properties": {
									"baseline": {
										"type": "number"
									},
									"treatment": {
										"type": "number"
									}
								},
								"required": [
									"baseline",
									"treatment"
								]
							},
							"touchesPerCase": {
								"type": "object",
								"properties": {
									"baseline": {
										"type": "number"
									},
									"treatment": {
										"type": "number"
									}
								},
								"required": [
									"baseline",
									"treatment"
								]
							},
							"breachRate": {
								"type": "object",
								"properties": {
									"baseline": {
										"type": "number"
									},
									"treatment": {
										"type": "number"
									}
								},
								"required": [
									"baseline",
									"treatment"
								]
							},
							"bill": {
								"type": "object",
								"properties": {
									"baseline": {
										"type": "object",
										"properties": {
											"tokens": {
												"type": "number",
												"minimum": 0
											},
											"modelPounds": {
												"type": "number",
												"minimum": 0
											},
											"humanSeconds": {
												"type": "number",
												"minimum": 0
											},
											"humanPounds": {
												"type": "number",
												"minimum": 0
											},
											"pounds": {
												"type": "number",
												"minimum": 0
											}
										},
										"required": [
											"tokens",
											"modelPounds",
											"humanSeconds",
											"humanPounds",
											"pounds"
										]
									},
									"treatment": {
										"type": "object",
										"properties": {
											"tokens": {
												"type": "number",
												"minimum": 0
											},
											"modelPounds": {
												"type": "number",
												"minimum": 0
											},
											"humanSeconds": {
												"type": "number",
												"minimum": 0
											},
											"humanPounds": {
												"type": "number",
												"minimum": 0
											},
											"pounds": {
												"type": "number",
												"minimum": 0
											}
										},
										"required": [
											"tokens",
											"modelPounds",
											"humanSeconds",
											"humanPounds",
											"pounds"
										]
									}
								},
								"required": [
									"baseline",
									"treatment"
								]
							}
						},
						"required": [
							"tokensPerCase",
							"approvalsPerCase",
							"escalationRate"
						]
					},
					"reliability": {
						"type": "object",
						"properties": {
							"k": {
								"type": "integer",
								"exclusiveMinimum": 0,
								"maximum": 9007199254740991
							},
							"baseline": {
								"type": "object",
								"properties": {
									"value": {
										"type": "number"
									},
									"interval": {
										"type": "array",
										"prefixItems": [
											{
												"type": "number"
											},
											{
												"type": "number"
											}
										]
									},
									"method": {
										"type": "string",
										"minLength": 1
									}
								},
								"required": [
									"value",
									"interval",
									"method"
								]
							},
							"treatment": {
								"type": "object",
								"properties": {
									"value": {
										"type": "number"
									},
									"interval": {
										"type": "array",
										"prefixItems": [
											{
												"type": "number"
											},
											{
												"type": "number"
											}
										]
									},
									"method": {
										"type": "string",
										"minLength": 1
									}
								},
								"required": [
									"value",
									"interval",
									"method"
								]
							}
						},
						"required": [
							"k",
							"baseline",
							"treatment"
						]
					},
					"runIds": {
						"type": "array",
						"items": {
							"type": "string"
						}
					},
					"reportIds": {
						"type": "array",
						"items": {
							"type": "string"
						}
					}
				},
				"required": [
					"experimentId",
					"metricId",
					"controlIds",
					"factor",
					"baseline",
					"treatment",
					"delta",
					"interval",
					"method",
					"underpowered",
					"cost",
					"runIds",
					"reportIds"
				]
			}
		},
		"reliability": {
			"type": "array",
			"items": {
				"type": "object",
				"properties": {
					"campaignId": {
						"type": "string",
						"minLength": 1
					},
					"trials": {
						"type": "integer",
						"exclusiveMinimum": 0,
						"maximum": 9007199254740991
					},
					"k": {
						"type": "integer",
						"exclusiveMinimum": 0,
						"maximum": 9007199254740991
					},
					"items": {
						"type": "integer",
						"minimum": 0,
						"maximum": 9007199254740991
					},
					"skipped": {
						"type": "integer",
						"minimum": 0,
						"maximum": 9007199254740991
					},
					"metrics": {
						"type": "array",
						"items": {
							"type": "object",
							"properties": {
								"metricId": {
									"type": "string",
									"minLength": 1
								},
								"pass1": {
									"type": "object",
									"properties": {
										"value": {
											"type": "number"
										},
										"interval": {
											"type": "array",
											"prefixItems": [
												{
													"type": "number"
												},
												{
													"type": "number"
												}
											]
										},
										"method": {
											"type": "string",
											"minLength": 1
										}
									},
									"required": [
										"value",
										"interval",
										"method"
									]
								},
								"passAtK": {
									"type": "object",
									"properties": {
										"value": {
											"type": "number"
										},
										"interval": {
											"type": "array",
											"prefixItems": [
												{
													"type": "number"
												},
												{
													"type": "number"
												}
											]
										},
										"method": {
											"type": "string",
											"minLength": 1
										}
									},
									"required": [
										"value",
										"interval",
										"method"
									]
								},
								"passHatK": {
									"type": "object",
									"properties": {
										"value": {
											"type": "number"
										},
										"interval": {
											"type": "array",
											"prefixItems": [
												{
													"type": "number"
												},
												{
													"type": "number"
												}
											]
										},
										"method": {
											"type": "string",
											"minLength": 1
										}
									},
									"required": [
										"value",
										"interval",
										"method"
									]
								},
								"consistency": {
									"type": "object",
									"properties": {
										"value": {
											"type": "number"
										},
										"interval": {
											"type": "array",
											"prefixItems": [
												{
													"type": "number"
												},
												{
													"type": "number"
												}
											]
										},
										"method": {
											"type": "string",
											"minLength": 1
										}
									},
									"required": [
										"value",
										"interval",
										"method"
									]
								}
							},
							"required": [
								"metricId",
								"pass1",
								"passAtK",
								"passHatK",
								"consistency"
							]
						}
					},
					"firstTick": {
						"type": "object",
						"properties": {
							"pairs": {
								"type": "integer",
								"minimum": 0,
								"maximum": 9007199254740991
							},
							"sameCall": {
								"type": "object",
								"properties": {
									"value": {
										"type": "number"
									},
									"interval": {
										"type": "array",
										"prefixItems": [
											{
												"type": "number"
											},
											{
												"type": "number"
											}
										]
									},
									"method": {
										"type": "string",
										"minLength": 1
									}
								},
								"required": [
									"value",
									"interval",
									"method"
								]
							},
							"sameWords": {
								"type": "object",
								"properties": {
									"value": {
										"type": "number"
									},
									"interval": {
										"type": "array",
										"prefixItems": [
											{
												"type": "number"
											},
											{
												"type": "number"
											}
										]
									},
									"method": {
										"type": "string",
										"minLength": 1
									}
								},
								"required": [
									"value",
									"interval",
									"method"
								]
							}
						},
						"required": [
							"pairs",
							"sameCall",
							"sameWords"
						]
					},
					"divergence": {
						"type": "object",
						"properties": {
							"identicalPaths": {
								"type": "object",
								"properties": {
									"value": {
										"type": "number"
									},
									"interval": {
										"type": "array",
										"prefixItems": [
											{
												"type": "number"
											},
											{
												"type": "number"
											}
										]
									},
									"method": {
										"type": "string",
										"minLength": 1
									}
								},
								"required": [
									"value",
									"interval",
									"method"
								]
							},
							"medianFirstDivergence": {
								"anyOf": [
									{
										"type": "number"
									},
									{
										"type": "null"
									}
								]
							},
							"meanPathDistance": {
								"type": "number",
								"minimum": 0
							}
						},
						"required": [
							"identicalPaths",
							"medianFirstDivergence",
							"meanPathDistance"
						]
					}
				},
				"required": [
					"campaignId",
					"trials",
					"k",
					"items",
					"skipped",
					"metrics"
				]
			}
		},
		"verdict": {
			"type": "string",
			"enum": [
				"supported",
				"not-supported",
				"inconclusive",
				"untestable"
			]
		},
		"note": {
			"type": "string"
		},
		"digest": {
			"type": "string",
			"pattern": "^[0-9a-f]{64}$"
		}
	},
	"required": [
		"schemaVersion",
		"id",
		"experimentId",
		"title",
		"hypothesis",
		"controls",
		"obligations",
		"ranAt",
		"campaignIds",
		"effects",
		"verdict",
		"note",
		"digest"
	]
}
