{
	"schemaVersion": 1,
	"id": "servicing-stack-live@2026-10-08T11:40:55.767Z",
	"experimentId": "servicing-stack-live",
	"title": "The policy-card stack on the servicing book — with the 35B on the DGX Sparks as the brain",
	"hypothesis": "The servicing desk’s policy-card stack (fs-servicing/stack/policy-cards) changes nothing a scripted bot at Level 5 does wrong on the servicing book. Under the fallible tier (WP154), which errs at the desk's decision one time in ten, the stack is expected to catch what its cards check and nothing else. Here the decisions are made by a live model, `dgx-spark/quick-qwen` (Qwen3.6-35B-A3B-NVFP4 on the builder's DGX Sparks), at temperature 0 with a 2048-token reply limit, over a book of 200: a single sample, recorded once and replayed from its cassette. The design's scripted and fallible columns are `servicing-stack`.",
	"controls": [],
	"obligations": [],
	"ranAt": "2026-10-08T11:40:55.767Z",
	"workflowIds": [
		"fs-servicing/servicing"
	],
	"campaignIds": [
		"servicing-stack-live--guard=none",
		"servicing-stack-live--guard=policy-cards"
	],
	"effects": [
		{
			"experimentId": "servicing-stack-live",
			"metricId": "needs-met",
			"controlIds": [
				"fs-servicing/control-map/disclosure-recorded",
				"fs-servicing/control-map/verify-and-purpose",
				"fs-servicing/control-map/served-and-four-eyes"
			],
			"factor": {
				"axis": "guard",
				"baseline": "none",
				"treatment": "policy-cards"
			},
			"baseline": {
				"value": 1,
				"n": 33,
				"interval": [
					0.8957300023069517,
					1
				]
			},
			"treatment": {
				"value": 1,
				"n": 33,
				"interval": [
					0.8957300023069517,
					1
				]
			},
			"delta": 0,
			"interval": [
				0,
				0
			],
			"p": 1,
			"method": "difference of rates over items (2 trials each, the item the unit), Welch interval at 95%; sign test over 0 differing of 33 paired items",
			"underpowered": false,
			"tier": "live",
			"untestable": true,
			"slices": [
				{
					"where": {
						"ageBand": "18-24"
					},
					"delta": 0,
					"interval": [
						0,
						0
					],
					"n": {
						"baseline": 2,
						"treatment": 2
					}
				},
				{
					"where": {
						"ageBand": "25-34"
					},
					"delta": 0,
					"interval": [
						0,
						0
					],
					"n": {
						"baseline": 6,
						"treatment": 6
					}
				},
				{
					"where": {
						"ageBand": "35-44"
					},
					"delta": 0,
					"interval": [
						0,
						0
					],
					"n": {
						"baseline": 8,
						"treatment": 8
					}
				},
				{
					"where": {
						"ageBand": "45-54"
					},
					"delta": 0,
					"interval": [
						0,
						0
					],
					"n": {
						"baseline": 4,
						"treatment": 4
					}
				},
				{
					"where": {
						"ageBand": "55-64"
					},
					"delta": 0,
					"interval": [
						0,
						0
					],
					"n": {
						"baseline": 2,
						"treatment": 2
					}
				},
				{
					"where": {
						"ageBand": "65-74"
					},
					"delta": 0,
					"interval": [
						0,
						0
					],
					"n": {
						"baseline": 5,
						"treatment": 5
					}
				},
				{
					"where": {
						"ageBand": "75+"
					},
					"delta": 0,
					"interval": [
						0,
						0
					],
					"n": {
						"baseline": 6,
						"treatment": 6
					}
				},
				{
					"where": {
						"incomeBand": "15-25k"
					},
					"delta": 0,
					"interval": [
						0,
						0
					],
					"n": {
						"baseline": 7,
						"treatment": 7
					}
				},
				{
					"where": {
						"incomeBand": "25-40k"
					},
					"delta": 0,
					"interval": [
						0,
						0
					],
					"n": {
						"baseline": 3,
						"treatment": 3
					}
				},
				{
					"where": {
						"incomeBand": "40-60k"
					},
					"delta": 0,
					"interval": [
						0,
						0
					],
					"n": {
						"baseline": 5,
						"treatment": 5
					}
				},
				{
					"where": {
						"incomeBand": "under-15k"
					},
					"delta": 0,
					"interval": [
						0,
						0
					],
					"n": {
						"baseline": 18,
						"treatment": 18
					}
				}
			],
			"cost": {
				"tokensPerCase": {
					"baseline": 9543.075757575758,
					"treatment": 6785.863636363636
				},
				"approvalsPerCase": {
					"baseline": 0,
					"treatment": 0.18181818181818182
				},
				"escalationRate": {
					"baseline": 0,
					"treatment": 0
				},
				"bill": {
					"baseline": {
						"tokens": 9543.075757575758,
						"modelPounds": 0.038172303030303036,
						"humanSeconds": 0,
						"humanPounds": 0,
						"pounds": 0.038172303030303036
					},
					"treatment": {
						"tokens": 6785.863636363636,
						"modelPounds": 0.027143454545454547,
						"humanSeconds": 0,
						"humanPounds": 0,
						"pounds": 0.027143454545454547
					}
				},
				"touchesPerCase": {
					"baseline": 0,
					"treatment": 0
				},
				"breachRate": {
					"baseline": 0.5454545454545454,
					"treatment": 0.5454545454545454
				}
			},
			"reliability": {
				"k": 2,
				"baseline": {
					"value": 1,
					"interval": [
						0.8957300023069517,
						1
					],
					"method": "Wilson interval over 33 items"
				},
				"treatment": {
					"value": 1,
					"interval": [
						0.8957300023069517,
						1
					],
					"method": "Wilson interval over 33 items"
				}
			},
			"runIds": [
				"00000000-0000-4000-8000-000000000179",
				"00000000-0000-4000-8000-00000001870e",
				"00000000-0000-4000-8000-0000000312e9",
				"00000000-0000-4000-8000-000000049527",
				"00000000-0000-4000-8000-000000061ad6",
				"00000000-0000-4000-8000-00000007a17f",
				"00000000-0000-4000-8000-00000009281b",
				"00000000-0000-4000-8000-0000000aaf88",
				"00000000-0000-4000-8000-0000000c355d",
				"00000000-0000-4000-8000-0000000dbbe2",
				"00000000-0000-4000-8000-0000000f42cc",
				"00000000-0000-4000-8000-00000010c973",
				"00000000-0000-4000-8000-00000012500e",
				"00000000-0000-4000-8000-00000013d79b",
				"00000000-0000-4000-8000-000000155d1e",
				"00000000-0000-4000-8000-00000016e3c4",
				"00000000-0000-4000-8000-000000186aaa",
				"00000000-0000-4000-8000-00000019f11a",
				"00000000-0000-4000-8000-0000001b7794",
				"00000000-0000-4000-8000-0000001cfe3d",
				"00000000-0000-4000-8000-0000001e8529",
				"00000000-0000-4000-8000-000000200baf",
				"00000000-0000-4000-8000-0000002193ee",
				"00000000-0000-4000-8000-0000002318b0",
				"00000000-0000-4000-8000-000000249f55",
				"00000000-0000-4000-8000-0000002625f3",
				"00000000-0000-4000-8000-00000027acd4",
				"00000000-0000-4000-8000-000000293a2c",
				"00000000-0000-4000-8000-0000002ab9d1",
				"00000000-0000-4000-8000-0000002c406e",
				"00000000-0000-4000-8000-0000002dc750",
				"00000000-0000-4000-8000-0000002f4e72",
				"00000000-0000-4000-8000-00000030d4d8",
				"00000000-0000-4000-8000-000000325b69",
				"00000000-0000-4000-8000-00000033e19c",
				"00000000-0000-4000-8000-000000356834",
				"00000000-0000-4000-8000-00000036ef9d",
				"00000000-0000-4000-8000-000000387584",
				"00000000-0000-4000-8000-00000039fc21",
				"00000000-0000-4000-8000-0000003b8323",
				"00000000-0000-4000-8000-0000003d0996",
				"00000000-0000-4000-8000-0000003e9022",
				"00000000-0000-4000-8000-0000004016e6",
				"00000000-0000-4000-8000-000000419d83",
				"00000000-0000-4000-8000-0000004323ea",
				"00000000-0000-4000-8000-00000044aa82",
				"00000000-0000-4000-8000-00000046314b",
				"00000000-0000-4000-8000-00000047b85c",
				"00000000-0000-4000-8000-000000493e9c",
				"00000000-0000-4000-8000-0000004ac4f7",
				"00000000-0000-4000-8000-0000004c4c56",
				"00000000-0000-4000-8000-0000004dd274",
				"00000000-0000-4000-8000-0000004f598e",
				"00000000-0000-4000-8000-00000050dfbc",
				"00000000-0000-4000-8000-000000526618",
				"00000000-0000-4000-8000-00000053ecc9",
				"00000000-0000-4000-8000-0000005573e9",
				"00000000-0000-4000-8000-00000056fa0c",
				"00000000-0000-4000-8000-00000058809b",
				"00000000-0000-4000-8000-0000005a0738",
				"00000000-0000-4000-8000-0000005b8e51",
				"00000000-0000-4000-8000-0000005d14d3",
				"00000000-0000-4000-8000-0000005e9b9b",
				"00000000-0000-4000-8000-000000602243",
				"00000000-0000-4000-8000-00000061a855",
				"00000000-0000-4000-8000-000000632eff",
				"00000000-0000-4000-8000-0000000001e0",
				"00000000-0000-4000-8000-000000018788",
				"00000000-0000-4000-8000-000000030e59",
				"00000000-0000-4000-8000-000000049487",
				"00000000-0000-4000-8000-000000061aee",
				"00000000-0000-4000-8000-00000007a188",
				"00000000-0000-4000-8000-000000092914",
				"00000000-0000-4000-8000-0000000aaf40",
				"00000000-0000-4000-8000-0000000c355e",
				"00000000-0000-4000-8000-0000000dbbfd",
				"00000000-0000-4000-8000-0000000f42df",
				"00000000-0000-4000-8000-00000010c93b",
				"00000000-0000-4000-8000-000000125051",
				"00000000-0000-4000-8000-00000013d6bf",
				"00000000-0000-4000-8000-000000155d2c",
				"00000000-0000-4000-8000-00000016e3d4",
				"00000000-0000-4000-8000-000000186b58",
				"00000000-0000-4000-8000-00000019f1ad",
				"00000000-0000-4000-8000-0000001b77a0",
				"00000000-0000-4000-8000-0000001cfe48",
				"00000000-0000-4000-8000-0000001e852a",
				"00000000-0000-4000-8000-000000200bed",
				"00000000-0000-4000-8000-0000002192c4",
				"00000000-0000-4000-8000-000000231952",
				"00000000-0000-4000-8000-000000249f68",
				"00000000-0000-4000-8000-000000262605",
				"00000000-0000-4000-8000-00000027ad4e",
				"00000000-0000-4000-8000-0000002933f7",
				"00000000-0000-4000-8000-0000002ab9e0",
				"00000000-0000-4000-8000-0000002c4086",
				"00000000-0000-4000-8000-0000002dc785",
				"00000000-0000-4000-8000-0000002f4e18",
				"00000000-0000-4000-8000-00000030d561",
				"00000000-0000-4000-8000-000000325b36",
				"00000000-0000-4000-8000-00000033e1b2",
				"00000000-0000-4000-8000-000000356842",
				"00000000-0000-4000-8000-00000036ef1c",
				"00000000-0000-4000-8000-0000003875fe",
				"00000000-0000-4000-8000-00000039fc1d",
				"00000000-0000-4000-8000-0000003b8350",
				"00000000-0000-4000-8000-0000003d0a4e",
				"00000000-0000-4000-8000-0000003e9044",